{
  "$schema": "../../schemas/current/benchmark.schema.json",
  "id": "proxy-chat-completions",
  "label": "LiteLLM proxy chat-completions sustainable capacity",
  "kind": "proxy",
  "artifact": "proxy",
  "output_metrics": [
    {
      "id": "nonstream.sustainable_rps",
      "unit": "RPS",
      "better": "higher"
    }
  ],
  "protocol": {
    "question": "What fixed arrival rate can one proxy worker sustain while meeting the declared latency, error, and achieved-load SLO?",
    "claim_scope": "One CPU-quota, one-worker non-streaming proxy capacity against a deterministic local validating mock whose fixture explicitly declares zero response delay. Capacity is the highest contiguous offered rate whose independent-trial pass fraction meets the declared rule; it excludes provider inference and streaming.",
    "experimental_unit": "One fresh proxy and mock container for each independently measured rate/round; bypass calibrations use a fresh mock",
    "scenarios": [
      {
        "id": "nonstream-arrival-sweep",
        "label": "Non-streaming fixed-arrival-rate saturation sweep",
        "dimensions": {
          "arrival_rates": [25, 50, 100, 150, 200, 300, 450],
          "stream": false
        }
      }
    ],
    "attempts": {
      "count": 7,
      "count_from": "rounds",
      "isolation": "Fresh proxy and mock containers for every rate/round; immutable local image IDs are resolved before container start",
      "order": "Rates are deterministically shuffled within each round from the comparison ID; workflow versions are Fisher–Yates shuffled per dispatch and executed serially",
      "retention": "Retain every rate trial, bypass calibration, exact plan, client summary/log, container log, fixture, configuration, and payload",
      "trials_per_attempt": 8,
      "unit": "independent round"
    },
    "measurements": [
      {
        "id": "slo_pass",
        "label": "Arrival rate meets all sustainable-capacity SLO predicates",
        "unit": "boolean",
        "role": "primary",
        "better": "higher"
      },
      {
        "id": "window_completion_rps",
        "label": "Successful completions timestamped inside the fixed measurement window divided by exactly 30 seconds",
        "unit": "RPS",
        "role": "secondary",
        "better": "higher"
      },
      {
        "id": "p95_latency_ms",
        "label": "p95 latency of successful completions inside the fixed measurement window",
        "unit": "ms",
        "role": "secondary",
        "better": "lower"
      },
      {
        "id": "window_error_rate",
        "label": "Failed completions divided by all completions timestamped inside the fixed measurement window",
        "unit": "ratio",
        "role": "secondary",
        "better": "lower"
      },
      {
        "id": "drain_seconds",
        "label": "Time after the fixed measurement deadline until the final started request completed",
        "unit": "s",
        "role": "diagnostic",
        "better": "lower"
      }
    ],
    "analyses": [
      {
        "id": "nonstream.capacity-knee",
        "label": "Highest contiguous offered rate meeting the required trial pass fraction",
        "measurement": "slo_pass",
        "additional_measurements": [
          "window_completion_rps",
          "p95_latency_ms",
          "window_error_rate",
          "drain_seconds"
        ],
        "aggregation": "contiguous SLO knee with per-round capacities, dispersion, and deterministic 10,000-resample bootstrap 95% CI",
        "report": [
          "rate pass fractions",
          "per-round capacity",
          "standard deviation",
          "median absolute deviation",
          "bootstrap 95% CI"
        ]
      }
    ],
    "validity": {
      "slo": "At least 6 of 7 trials at a rate must have p95 latency <= 100 ms, window error rate 0, no dropped arrivals, >= 98% achieved/offered RPS, and stable warmup; every lower rate must also pass",
      "warmup": "The same fixed-arrival executor and request path run for 30 seconds before measurement; the final three five-second successful-completion windows must have coefficient of variation <= 5%",
      "window": "Only completions timestamped no later than the fixed 30-second deadline enter throughput, errors, and latency; post-deadline completions and drain time are separate diagnostics",
      "translation": "The mock rejects any mismatch in method/path, authorization and content-type headers, non-stream semantics (stream omitted or false), or the exact allowlisted JSON body",
      "headroom": "Each round bypasses the proxy at 1.5x the maximum sweep rate; achieved load and errors must meet the SLO, mock and load-generator CPU must remain below 85%, and mock CFS throttling must stay below 0.1% of wall time; k6 pre-allocates ceil(rate x SLO x 4) VUs (bounded to 16..512) so the open-model executor never starves for VUs below the SLO",
      "retries": "Every round (one trial per swept rate plus its calibration) is an independent unit; if any trial in a round loses measurement integrity or its calibration fails headroom, that whole round is re-run up to 3 attempts with fresh containers, every attempt's artifacts are retained, and trials from different attempts are never mixed",
      "apparatus": "Proxy, mock, and load generator use disjoint CPU sets; the retained upstream fixture is the sole timing source and explicitly declares zero response delay; cgroup quota/cpuset/throttling, utilization, host pressure, image IDs, kernel/topology/governor, runner image, repository identity, and input hashes are retained",
      "fail_closed": "Missing/invalid telemetry, unstable calibration, unbracketed saturation, request-count mismatch, response-semantic mismatch, or any upstream translation failure invalidates the result"
    }
  },
  "jobs": [
    {
      "id": "base",
      "canonical": true,
      "runner": "ubuntu-24.04",
      "requirements": {
        "platform": "linux",
        "architecture": "x86_64",
        "host": "github-hosted",
        "tools": ["k6"],
        "docker": {
          "architecture": "x86_64",
          "cgroup_version": "2",
          "ports": [4020]
        }
      },
      "config": {
        "rounds": 7,
        "arrival_rates": [25, 50, 100, 150, 200, 300, 450],
        "duration_seconds": 30,
        "warmup_seconds": 30,
        "steady_state": {
          "window_seconds": 5,
          "windows": 3,
          "maximum_cv": 0.05
        },
        "slo": {
          "p95_latency_ms": 100,
          "maximum_error_rate": 0,
          "minimum_achievement_ratio": 0.98,
          "required_pass_fraction": 0.8571428571428571
        },
        "retry_attempts": 3,
        "vu_allocation": {
          "slo_multiple": 4,
          "minimum_vus": 16
        },
        "max_vus": 512,
        "calibration_rate_multiplier": 1.5,
        "calibration_headroom": {
          "maximum_cpu_percent": 85,
          "maximum_throttled_fraction": 0.001
        },
        "mock_image": "node:24.8.0-slim@sha256:cadbfafeb6baf87eaaffa40b3640209c4b7fd38cebde65059d15bc39cd636b85",
        "resources": {
          "cpus": 1,
          "memory": "2g",
          "workers": 1,
          "idle_seconds": 5,
          "log_driver": "none",
          "mock_cpus": 1,
          "mock_memory": "1g",
          "cpu_sets": {
            "proxy": "0",
            "mock": "1",
            "load_generator": "2"
          }
        }
      }
    }
  ]
}
